{
  "capability": "second-brain.learn.v1",
  "correlation_id": "c3d4e5f6-a7b8-9012-cdef-123456789012",
  "source_type": "session",
  "content": "Azure Container Apps requires the --mi-user-assigned flag when attaching a user-assigned managed identity. The documentation only describes the system-assigned identity path; the user-assigned variant is undocumented and discovered by trial and error with the CLI.",
  "category": "discovery",
  "confidence": "verified",
  "context": {
    "project": "sample-infra-project",
    "session": "session-002",
    "date": "2025-01-16",
    "tags": ["azure", "managed-identity", "container-apps"]
  }
}
