{
  "capability": "second-brain.learn.v1",
  "correlation_id": "b2c3d4e5-f6a7-8901-bcde-f12345678901",
  "source_type": "session",
  "content": "Kubernetes IfNotPresent pull policy silently serves stale images when using a mutable tag such as :latest. Always use immutable tags (digest or versioned) in production, or set pullPolicy: Always when mutable tags are required.",
  "category": "pattern",
  "confidence": "verified",
  "context": {
    "project": "sample-project",
    "session": "session-abc-123",
    "date": "2024-06-01",
    "tags": ["kubernetes", "deployment", "images"]
  }
}
